{
  "schemaVersion": "orbital.show-score/1.0",
  "title": "Orbital 48-minute supercycle",
  "durationS": 2880,
  "loop": true,
  "movements": [
    {
      "id": "dormancy",
      "name": "Dormancy",
      "startS": 0,
      "durationS": 360,
      "majorPeak": false,
      "description": "Near darkness, low-frequency pressure, sparse drift and the first evidence that the system is listening.",
      "start": {
        "energy": 0.08,
        "brightness": 0.025,
        "visualDensity": 0.04,
        "fluidity": 0.42,
        "fracture": 0.02,
        "glitch": 0.01,
        "organic": 0.14,
        "melody": 0.01,
        "sub": 0.3,
        "spatialMotion": 0.06,
        "residualGain": 0.12,
        "predictionVisibility": 0,
        "fanCue": 0.46
      },
      "end": {
        "energy": 0.2,
        "brightness": 0.09,
        "visualDensity": 0.13,
        "fluidity": 0.66,
        "fracture": 0.04,
        "glitch": 0.025,
        "organic": 0.24,
        "melody": 0.03,
        "sub": 0.42,
        "spatialMotion": 0.16,
        "residualGain": 0.2,
        "predictionVisibility": 0.05,
        "fanCue": 0.5
      },
      "localPeak": {
        "at": 0.68,
        "energy": 0.24,
        "brightness": 0.12,
        "visualDensity": 0.16,
        "sub": 0.48,
        "fanCue": 0.53
      }
    },
    {
      "id": "observation",
      "name": "Observation",
      "startS": 360,
      "durationS": 360,
      "majorPeak": false,
      "description": "Restrained contours, a fluid skin and spatial traces make the measured sphere legible.",
      "start": {
        "energy": 0.2,
        "brightness": 0.09,
        "visualDensity": 0.13,
        "fluidity": 0.66,
        "fracture": 0.04,
        "glitch": 0.025,
        "organic": 0.24,
        "melody": 0.03,
        "sub": 0.42,
        "spatialMotion": 0.16,
        "residualGain": 0.2,
        "predictionVisibility": 0.05,
        "fanCue": 0.5
      },
      "end": {
        "energy": 0.36,
        "brightness": 0.18,
        "visualDensity": 0.27,
        "fluidity": 0.78,
        "fracture": 0.1,
        "glitch": 0.07,
        "organic": 0.3,
        "melody": 0.08,
        "sub": 0.5,
        "spatialMotion": 0.32,
        "residualGain": 0.34,
        "predictionVisibility": 0.24,
        "fanCue": 0.55
      },
      "localPeak": {
        "at": 0.57,
        "energy": 0.44,
        "brightness": 0.22,
        "visualDensity": 0.32,
        "fluidity": 0.86,
        "spatialMotion": 0.4,
        "fanCue": 0.58
      }
    },
    {
      "id": "prediction",
      "name": "Prediction",
      "startS": 720,
      "durationS": 360,
      "majorPeak": true,
      "description": "A second audiovisual body anticipates the sphere, separates from observation and reaches the first major fracture.",
      "start": {
        "energy": 0.36,
        "brightness": 0.18,
        "visualDensity": 0.27,
        "fluidity": 0.78,
        "fracture": 0.1,
        "glitch": 0.07,
        "organic": 0.3,
        "melody": 0.08,
        "sub": 0.5,
        "spatialMotion": 0.32,
        "residualGain": 0.34,
        "predictionVisibility": 0.24,
        "fanCue": 0.55
      },
      "end": {
        "energy": 0.42,
        "brightness": 0.16,
        "visualDensity": 0.25,
        "fluidity": 0.46,
        "fracture": 0.42,
        "glitch": 0.36,
        "organic": 0.2,
        "melody": 0.04,
        "sub": 0.48,
        "spatialMotion": 0.4,
        "residualGain": 0.72,
        "predictionVisibility": 0.58,
        "fanCue": 0.52
      },
      "localPeak": {
        "at": 0.72,
        "energy": 0.76,
        "brightness": 0.44,
        "visualDensity": 0.63,
        "fluidity": 0.62,
        "fracture": 0.82,
        "glitch": 0.7,
        "organic": 0.18,
        "melody": 0.06,
        "sub": 0.78,
        "spatialMotion": 0.76,
        "residualGain": 0.94,
        "predictionVisibility": 0.9,
        "fanCue": 0.67
      }
    },
    {
      "id": "recession",
      "name": "Recession",
      "startS": 1080,
      "durationS": 360,
      "majorPeak": false,
      "description": "Darkness returns, errors decay, the room breathes and attention resets without becoming empty.",
      "start": {
        "energy": 0.42,
        "brightness": 0.16,
        "visualDensity": 0.25,
        "fluidity": 0.46,
        "fracture": 0.42,
        "glitch": 0.36,
        "organic": 0.2,
        "melody": 0.04,
        "sub": 0.48,
        "spatialMotion": 0.4,
        "residualGain": 0.72,
        "predictionVisibility": 0.58,
        "fanCue": 0.52
      },
      "end": {
        "energy": 0.12,
        "brightness": 0.045,
        "visualDensity": 0.07,
        "fluidity": 0.58,
        "fracture": 0.08,
        "glitch": 0.035,
        "organic": 0.3,
        "melody": 0.05,
        "sub": 0.3,
        "spatialMotion": 0.12,
        "residualGain": 0.18,
        "predictionVisibility": 0.08,
        "fanCue": 0.47
      },
      "localPeak": {
        "at": 0.21,
        "energy": 0.5,
        "brightness": 0.2,
        "fracture": 0.48,
        "glitch": 0.4,
        "residualGain": 0.78,
        "fanCue": 0.56
      }
    },
    {
      "id": "human-archive",
      "name": "Human archive",
      "startS": 1440,
      "durationS": 360,
      "majorPeak": false,
      "description": "Organic fragments, breath and warmth emerge as a false convergence rather than a solved humanity.",
      "start": {
        "energy": 0.12,
        "brightness": 0.045,
        "visualDensity": 0.07,
        "fluidity": 0.58,
        "fracture": 0.08,
        "glitch": 0.035,
        "organic": 0.3,
        "melody": 0.05,
        "sub": 0.3,
        "spatialMotion": 0.12,
        "residualGain": 0.18,
        "predictionVisibility": 0.08,
        "fanCue": 0.47
      },
      "end": {
        "energy": 0.46,
        "brightness": 0.25,
        "visualDensity": 0.32,
        "fluidity": 0.84,
        "fracture": 0.15,
        "glitch": 0.09,
        "organic": 0.78,
        "melody": 0.52,
        "sub": 0.48,
        "spatialMotion": 0.45,
        "residualGain": 0.35,
        "predictionVisibility": 0.2,
        "fanCue": 0.56
      },
      "localPeak": {
        "at": 0.61,
        "energy": 0.58,
        "brightness": 0.34,
        "visualDensity": 0.41,
        "fluidity": 0.93,
        "organic": 0.9,
        "melody": 0.66,
        "sub": 0.57,
        "spatialMotion": 0.54,
        "fanCue": 0.6
      }
    },
    {
      "id": "contradiction",
      "name": "Contradiction",
      "startS": 1800,
      "durationS": 360,
      "majorPeak": true,
      "description": "Machine precision, physical turbulence and human material conflict, producing the second major peak.",
      "start": {
        "energy": 0.46,
        "brightness": 0.25,
        "visualDensity": 0.32,
        "fluidity": 0.84,
        "fracture": 0.15,
        "glitch": 0.09,
        "organic": 0.78,
        "melody": 0.52,
        "sub": 0.48,
        "spatialMotion": 0.45,
        "residualGain": 0.35,
        "predictionVisibility": 0.2,
        "fanCue": 0.56
      },
      "end": {
        "energy": 0.55,
        "brightness": 0.24,
        "visualDensity": 0.36,
        "fluidity": 0.52,
        "fracture": 0.5,
        "glitch": 0.44,
        "organic": 0.48,
        "melody": 0.28,
        "sub": 0.56,
        "spatialMotion": 0.58,
        "residualGain": 0.76,
        "predictionVisibility": 0.6,
        "fanCue": 0.54
      },
      "localPeak": {
        "at": 0.58,
        "energy": 0.9,
        "brightness": 0.58,
        "visualDensity": 0.8,
        "fluidity": 0.38,
        "fracture": 0.96,
        "glitch": 0.9,
        "organic": 0.35,
        "melody": 0.18,
        "sub": 0.9,
        "spatialMotion": 0.92,
        "residualGain": 1,
        "predictionVisibility": 0.94,
        "fanCue": 0.76
      }
    },
    {
      "id": "bloom",
      "name": "Bloom",
      "startS": 2160,
      "durationS": 360,
      "majorPeak": false,
      "description": "Harmony, fluidity and melody become dominant while residual instability remains visible and audible.",
      "start": {
        "energy": 0.55,
        "brightness": 0.24,
        "visualDensity": 0.36,
        "fluidity": 0.52,
        "fracture": 0.5,
        "glitch": 0.44,
        "organic": 0.48,
        "melody": 0.28,
        "sub": 0.56,
        "spatialMotion": 0.58,
        "residualGain": 0.76,
        "predictionVisibility": 0.6,
        "fanCue": 0.54
      },
      "end": {
        "energy": 0.68,
        "brightness": 0.38,
        "visualDensity": 0.47,
        "fluidity": 0.94,
        "fracture": 0.2,
        "glitch": 0.12,
        "organic": 0.94,
        "melody": 0.86,
        "sub": 0.68,
        "spatialMotion": 0.7,
        "residualGain": 0.48,
        "predictionVisibility": 0.38,
        "fanCue": 0.61
      },
      "localPeak": {
        "at": 0.66,
        "energy": 0.76,
        "brightness": 0.48,
        "visualDensity": 0.55,
        "fluidity": 1,
        "fracture": 0.24,
        "glitch": 0.17,
        "organic": 1,
        "melody": 0.95,
        "sub": 0.76,
        "spatialMotion": 0.8,
        "residualGain": 0.56,
        "predictionVisibility": 0.45,
        "fanCue": 0.66
      }
    },
    {
      "id": "convergence-and-loss",
      "name": "Convergence and loss",
      "startS": 2520,
      "durationS": 360,
      "majorPeak": true,
      "description": "The largest luminous and musical state arrives, then information is shed until darkness can begin again.",
      "start": {
        "energy": 0.68,
        "brightness": 0.38,
        "visualDensity": 0.47,
        "fluidity": 0.94,
        "fracture": 0.2,
        "glitch": 0.12,
        "organic": 0.94,
        "melody": 0.86,
        "sub": 0.68,
        "spatialMotion": 0.7,
        "residualGain": 0.48,
        "predictionVisibility": 0.38,
        "fanCue": 0.61
      },
      "end": {
        "energy": 0.08,
        "brightness": 0.025,